<?xml version="1.0" encoding="UTF-8"?>

<!-- 
Sample USA address.  Uses 'standard' format. Correct formatting is:

  Stewart Evans
  PO Box 1273
  Santa Cruz, CA 95061
  USA

$Id$
-->

<?xml-stylesheet href="html.xsl" type="text/xsl"?>
<!DOCTYPE resume PUBLIC "-//Sean Kelly//DTD Resume 1.2.2//EN" "http://xmlresume.sourceforge.net/dtd/resume.dtd">

<resume>
  <header>
    <name>
      <firstname>Stewart</firstname>
      <surname>Evans</surname>
    </name>
    <address>
      <street>PO Box 1273</street>
      <city>Santa Cruz</city>
      <zip>95061</zip>
      <state>CA</state>
      <country>USA</country>
    </address>
  </header>
</resume>
