<?xml version="1.0"?>
<?xml-stylesheet href="./xsl/html_professional.xsl" type="text/xsl"?>
<!DOCTYPE resume PUBLIC "-//Sean Kelly//DTD Resume 1.3.1//EN"
                        "./dtd/resume.dtd">
<resume>
	<header>
		<!-- changed MS address2 to address-->
		<name>
			<firstname>Max</firstname>
			<surname>Benson</surname>
		</name>
		<address>
			<street>100 Anywhere Street</street>
			<city>Anywhere</city>
			<state>NY</state>
			<zip>10280</zip>
		</address>
		<!--changed MS address1 to contact -->
		<contact>
			<phone>212-222-2222</phone>
			<email>maxbenson@foobar.net</email>
			<url>http.www.maxbenson.net/resume.html</url>
		</contact>
	</header>
	<objective>
		<para>To enter into that activity of the soul wherein I exhibit excellence</para>
	</objective>
	<!--	deleted SectionTitle and made History, Academics, and so on -->
	<history>
		<job>
			<jobtitle>National Sales Manager</jobtitle>
			<employer>Arbor Shoe</employer>
			<period>
				<from>
					<date>
						<month/>
						<year>1990</year>
					</date>
				</from>
				<to>
					<date>
						<month/>
						<year>1994</year>
					</date>
				</to>
			</period>
			<!-- RK: Deleted location of employer.  XSL indicates some handling of job city and state, but DTD does not? I couldn't figure out how to make it pass validation -->
			<achievements>
				<achievement>Increased sales from $50 million to $100 million.</achievement>
				<achievement>Doubled sales per representative from $5 million to $10 million.</achievement>
				<achievement>Suggested new products that increased earnings by 23%</achievement>
			</achievements>
		</job>
		<job>
			<jobtitle>District Sales Manager</jobtitle>
			<employer>Ferguson and Bardwell</employer>
			<period>
				<from>
					<date>
						<month/>
						<year>1985</year>
					</date>
				</from>
				<to>
					<date>
						<month/>
						<year>1990</year>
					</date>
				</to>
			</period>
			<!-- Deleted location of employer, no tag? -->
			<achievements>
				<achievement>Increased regional sales from $25 million to $350 million.</achievement>
				<achievement>Managed 250 sales representatives in 10 Western states.</achievement>
				<achievement>Implemented training course for new recruits — speeding profitability.</achievement>
			</achievements>
		</job>
		<job>
			<jobtitle>Senior Sales Representative</jobtitle>
			<employer>Duffy Vineyards</employer>
			<period>
				<from>
					<date>
						<month/>
						<year>1980</year>
					</date>
				</from>
				<to>
					<date>
						<month/>
						<year>1984</year>
					</date>
				</to>
			</period>
			<!-- Deleted location of employer, no tag? -->
			<achievements>
				<achievement>Expanded sales team from 50 to 100 representatives.</achievement>
				<achievement>Tripled division revenues for each sales associate.</achievement>
				<achievement>Expanded sales to include mass-market accounts.</achievement>
			</achievements>
		</job>
		<job>
			<jobtitle>Senior Sales Representative</jobtitle>
			<employer>LitWare, Inc.</employer>
			<period>
				<from>
					<date>
						<month/>
						<year>1975</year>
					</date>
				</from>
				<to>
					<date>
						<month/>
						<year>1980</year>
					</date>
				</to>
			</period>
			<!-- Deleted location of employer, no tag? -->
			<achievements>
				<achievement>Expanded territorial sales by 400%.</achievement>
				<achievement>Received company’s highest sales award four years in a row.</achievement>
				<achievement>Developed Excellence in Sales training course.</achievement>
			</achievements>
		</job>
	</history>
	<academics>
		<degrees>
			<degree>
				<level>B.A.</level>
				<major>Business Administration and Computer Science.</major>
				<!-- didn't have right structure to do a from-to period for the education 
				<period>
			<from><date><month/><year>1971</year></date></from>
			<to><date><month/><year>1975</year></date></to>
				</period> -->
				<date>
					<month>May</month>
					<year>1975</year>
				</date>
				<institution>South Ridge State University</institution>
				<annotation>Graduated summa cum laude.</annotation>
			</degree>
		</degrees>
	</academics>
	<!-- Did not include, no corresponding tags 
	<SectionTitle>
		<p>Interests</p>
	</SectionTitle>
	<Institution>
		<p>SR Board of Directors, running, gardening, carpentry, computers.</p>
	</Institution>
	<Normal>
		<p></p>
	</Normal>
	<SectionTitle>
		<p>Tips</p>
	</SectionTitle>
	<Objective>
		<p>What the heck are tips?</p>
	</Objective>
	<Normal>
		<p></p>
		<p/>
	</Normal>
-->
</resume>
